{
    "taskRef": "T1",
    "timestamp": "2026-03-07T06:15:30Z",
    "filesCreated": [],
    "filesModified": [
        "AI/_rag_index/README.md"
    ],
    "filesDeleted": [],
    "linesAdded": 28,
    "linesRemoved": 0,
    "skillsUsed": [],
    "testResults": {
        "passed": 0,
        "failed": 0,
        "skipped": 0
    },
    "blockers": [],
    "scopeNotes": "No scope changes from plan"
}